{"$schema":"https://json-schema.org/draft/2020-12/schema","title":"AWA Presentation Binding v0.1","description":"","type":"object","required":["contract","binding_id","target","semantic_role","artifact_refs","runtime_event_map","input_action_map","fallback","version"],"properties":{"contract":{"const":"presentation-binding.v0.1"},"binding_id":{"type":"string","minLength":1},"target":{"type":"string","enum":["threejs","godot","unity","terminal","custom"]},"semantic_role":{"type":"string","minLength":1},"artifact_refs":{"type":"array","items":{"type":"string","minLength":1},"uniqueItems":true},"runtime_event_map":{"type":"object","additionalProperties":{"type":"string","minLength":1}},"input_action_map":{"type":"object","additionalProperties":{"type":"string","minLength":1}},"fallback":{"type":["string","null"]},"version":{"type":"string","pattern":"^v\\d+\\.\\d+$"}},"additionalProperties":false,"$id":"urn:awa:schema:presentation-binding-v0-1"}
